<?xml version="1.0" encoding="utf-8"?>
<!DOCTYPE FLExTransRuleGenerator PUBLIC "-//XMLmind//DTD FLExTransRuleGenerator//EN" "FLExTransRuleGenerator.dtd">
<FLExTransRuleGenerator>
  <FLExTransRules>
    <FLExTransRule name="Def N">
      <Source>
        <Phrase>
          <Words>
            <Word category="def" id="1">
            </Word>
            <Word category="n" id="2">
            </Word>
          </Words>
        </Phrase>
      </Source>
      <Target>
        <Phrase>
          <Words>
            <Word head="no" id="1">
              <Features>
                <Feature label="number" match="n" ranking="1"/>
                <Feature label="gender" match="g" ranking="2"/>
              </Features>
            </Word>
            <Word head="yes" id="2">
				<Features>
					<Feature label="gender" match="g"/>
				</Features>
				<Affixes>
					<Affix type="suffix">
						<Features>
							<Feature label="number" match="n"/>
						</Features>
					</Affix>
				</Affixes>
            </Word>
          </Words>
        </Phrase>
      </Target>
    </FLExTransRule>
  </FLExTransRules>
</FLExTransRuleGenerator>
