<?xml version="1.0" encoding="utf-8"?>
<!DOCTYPE FLExTransRuleGenerator PUBLIC "-//XMLmind//DTD FLExTransRuleGenerator//EN"
"FLExTransRuleGenerator.dtd">
<FLExTransRuleGenerator
><FLExTransRules
><FLExTransRule
name="Adjective - Noun"
><Source
><Phrase
><Words
><Word
category="adj"
id="1"
></Word
><Word
category="n"
id="2"
></Word
></Words
></Phrase
></Source
><Target
><Phrase
><Words
><Word
head="yes"
id="2"
><Features
><Feature
label="gender"
match="α"
></Feature
></Features
></Word
><Word
head="no"
id="1"
><Affixes
><Affix
type="suffix"
><Features
><Feature
label="gender"
match="α"
></Feature
></Features
></Affix
></Affixes
></Word
></Words
></Phrase
></Target
></FLExTransRule
></FLExTransRules
></FLExTransRuleGenerator
>
