<?xml version="1.0" encoding="utf-8"?>
<!DOCTYPE FLExTransRuleGenerator PUBLIC "-//XMLmind//DTD FLExTransRuleGenerator//EN"
"FLExTransRuleGenerator.dtd">
<FLExTransRuleGenerator
><FLExTransRules
><FLExTransRule
name="Indefinite - Adjective - Noun"
><Source
><Phrase
><Words
><Word
category="indef"
head="no"
id="1"
><Features
></Features
><Affixes
></Affixes
></Word
><Word
category="adj"
head="no"
id="2"
><Features
></Features
><Affixes
></Affixes
></Word
><Word
category="n"
head="no"
id="3"
><Features
></Features
><Affixes
></Affixes
></Word
></Words
></Phrase
></Source
><Target
><Phrase
><Words
><Word
category=""
head="no"
id="1"
><Features
></Features
><Affixes
><Affix
type="suffix"
><Features
><Feature
label="gender"
match="α"
></Feature
></Features
></Affix
><Affix
type="suffix"
><Features
><Feature
label="number"
match="β"
></Feature
></Features
></Affix
></Affixes
></Word
><Word
category=""
head="yes"
id="3"
><Features
><Feature
label="gender"
match="α"
></Feature
></Features
><Affixes
><Affix
type="suffix"
><Features
><Feature
label="number"
match="β"
></Feature
></Features
></Affix
></Affixes
></Word
><Word
category=""
head="no"
id="2"
><Features
></Features
><Affixes
><Affix
type="suffix"
><Features
><Feature
label="gender"
match="α"
></Feature
></Features
></Affix
><Affix
type="suffix"
><Features
><Feature
label="number"
match="β"
></Feature
></Features
></Affix
></Affixes
></Word
></Words
></Phrase
></Target
></FLExTransRule
></FLExTransRules
></FLExTransRuleGenerator
>
