<?xml version="1.0" encoding="utf-8"?>
<!DOCTYPE FLExTransRuleGenerator PUBLIC " -//XMLmind//DTD FLExTransRuleGenerator//EN"
"FLExTransRuleGenerator.dtd">
<FLExTransRuleGenerator>
	<DisjointFeatureSets/>
	<FLExTransRules>
		<FLExTransRule name="Def Adj N" create_permutations="yes">
			<Description/>
			<Source>
				<Phrase>
					<Words>
						<Word category="def" head="no" id="3">
							<Features/>
							<Affixes/>
						</Word>
						<Word category="n" head="no" id="1">
							<Features/>
							<Affixes/>
						</Word>
						<Word category="adj" head="no" id="2">
							<Features/>
							<Affixes/>
						</Word>
					</Words>
				</Phrase>
			</Source>
			<Target>
				<Phrase>
					<Words>
						<Word category="" head="no" id="3">
							<Features>
								<Feature label="gender" match="α" ranking="2" unmarked_default="" value=""/>
								<Feature label="number" match="β" ranking="1" unmarked_default="" value=""/>
							</Features>
							<Affixes/>
						</Word>
						<Word category="" head="no" id="2">
							<Features/>
							<Affixes>
								<Affix type="suffix">
									<Features>
										<Feature label="gender" match="α" ranking="0" unmarked_default="m" value=""/>
									</Features>
								</Affix>
								<Affix type="suffix">
									<Features>
										<Feature label="number" match="β" ranking="0" unmarked_default="" value=""/>
									</Features>
								</Affix>
							</Affixes>
						</Word>
						<Word category="" head="yes" id="1">
							<Features>
								<Feature label="gender" match="α" ranking="0" unmarked_default="" value=""/>
							</Features>
							<Affixes>
								<Affix type="suffix">
									<Features>
										<Feature label="number" match="β" ranking="0" unmarked_default="sg" value=""/>
									</Features>
								</Affix>
							</Affixes>
						</Word>
					</Words>
				</Phrase>
			</Target>
		</FLExTransRule>
		<FLExTransRule name="Indf Adj N" create_permutations="no">
			<Description/>
			<Source>
				<Phrase>
					<Words>
						<Word category="indf" head="no" id="1">
							<Features/>
							<Affixes/>
						</Word>
						<Word category="n" head="no" id="2">
							<Features/>
							<Affixes/>
						</Word>
						<Word category="adj" head="no" id="3">
							<Features/>
							<Affixes/>
						</Word>
					</Words>
				</Phrase>
			</Source>
			<Target>
				<Phrase>
					<Words>
						<Word category="" head="no" id="1">
							<Features>
								<Feature label="gender" match="α" ranking="2" unmarked_default="" value=""/>
								<Feature label="number" match="β" ranking="1" unmarked_default="" value=""/>
							</Features>
							<Affixes/>
						</Word>
						<Word category="" head="no" id="3">
							<Features/>
							<Affixes>
								<Affix type="suffix">
									<Features>
										<Feature label="gender" match="α" ranking="0" unmarked_default="m" value=""/>
									</Features>
								</Affix>
								<Affix type="suffix">
									<Features>
										<Feature label="number" match="β" ranking="0" unmarked_default="" value=""/>
									</Features>
								</Affix>
							</Affixes>
						</Word>
						<Word category="" head="yes" id="2">
							<Features>
								<Feature label="gender" match="α" ranking="0" unmarked_default="" value=""/>
							</Features>
							<Affixes>
								<Affix type="suffix">
									<Features>
										<Feature label="number" match="β" ranking="0" unmarked_default="sg" value=""/>
									</Features>
								</Affix>
							</Affixes>
						</Word>
					</Words>
				</Phrase>
			</Target>
		</FLExTransRule>
		<FLExTransRule name="Indf N" create_permutations="no">
			<Description/>
			<Source>
				<Phrase>
					<Words>
						<Word category="indf" head="no" id="1">
							<Features/>
							<Affixes/>
						</Word>
						<Word category="n" head="no" id="2">
							<Features/>
							<Affixes/>
						</Word>
					</Words>
				</Phrase>
			</Source>
			<Target>
				<Phrase>
					<Words>
						<Word category="" head="no" id="1">
							<Features>
								<Feature label="gender" match="α" ranking="2" unmarked_default="" value=""/>
								<Feature label="number" match="β" ranking="1" unmarked_default="" value=""/>
							</Features>
							<Affixes/>
						</Word>
						<Word category="" head="yes" id="2">
							<Features>
								<Feature label="gender" match="α" ranking="0" unmarked_default="" value=""/>
							</Features>
							<Affixes>
								<Affix type="suffix">
									<Features>
										<Feature label="number" match="β" ranking="0" unmarked_default="sg" value=""/>
									</Features>
								</Affix>
							</Affixes>
						</Word>
					</Words>
				</Phrase>
			</Target>
		</FLExTransRule>
	</FLExTransRules>
</FLExTransRuleGenerator>
